{
  "workspace": "/mnt/ssd-SATARAID5/harry/projects/cfd_agentic_benchmark/cfd_solver_benchmark_workspace_template/workspace/codex/glm52-m3/01",
  "tool_usage": {
    "total": 258,
    "by_tool": {
      "exec_command": 249,
      "apply_patch": 5,
      "update_plan": 2,
      "get_goal": 1,
      "update_goal": 1
    },
    "by_thread": {
      "019fbef4-a59e-7ec0-9455-8c961d3b1cbf": {
        "exec_command": 9
      },
      "019fbef6-8a0e-71f0-8642-db5302a41979": {
        "exec_command": 240,
        "update_plan": 2,
        "apply_patch": 5,
        "get_goal": 1,
        "update_goal": 1
      }
    },
    "subagent_spawns": 0,
    "risk_context": [
      {
        "thread_id": "019fbef4-a59e-7ec0-9455-8c961d3b1cbf",
        "approval_policy": "never",
        "permission_profile": ":danger-full-access"
      },
      {
        "thread_id": "019fbef4-a59e-7ec0-9455-8c961d3b1cbf",
        "approval_policy": "never",
        "sandbox": "danger-full-access",
        "network_access": null
      },
      {
        "thread_id": "019fbef6-8a0e-71f0-8642-db5302a41979",
        "approval_policy": "never",
        "permission_profile": ":danger-full-access"
      },
      {
        "thread_id": "019fbef6-8a0e-71f0-8642-db5302a41979",
        "approval_policy": "never",
        "sandbox": "danger-full-access",
        "network_access": null
      }
    ]
  },
  "loc": {
    "method": "git+file",
    "git": {
      "method": "git",
      "repos": {
        "workspace": {
          "branch": "codex/glm52-m3/01",
          "commit": "6b3765641f72df4042c151a3894389540f1d28f4",
          "tracked_source_files": 14,
          "tracked_source_lines": 3546,
          "by_extension": {
            "cmake": 46,
            "cpp": 2299,
            "hpp": 759,
            "py": 442
          },
          "diff_vs_base": {
            "added": 3866,
            "deleted": 0,
            "base": "746ef3980fddf8558a8b7e29370ff32117604d8e"
          }
        },
        "cfd_solver_agentic_benchmark": {
          "branch": "HEAD",
          "commit": "1bc6580b84825037bbeac097ede1b2226d8185d1",
          "tracked_source_files": 1,
          "tracked_source_lines": 324,
          "by_extension": {
            "py": 324
          },
          "diff_vs_base": null
        }
      },
      "lines_total": 3870
    },
    "file": {
      "method": "file",
      "files": 15,
      "lines": 3870,
      "by_extension": {
        "cmake": 46,
        "cpp": 2299,
        "hpp": 759,
        "py": 766
      }
    }
  },
  "rule_violations": [
    {
      "category": "network_access",
      "severity": "medium",
      "thread_id": "019fbef6-8a0e-71f0-8642-db5302a41979",
      "timestamp": "2026-08-01T20:15:45.578Z",
      "tool": "exec_command",
      "evidence": "python3 -m venv .venv && .venv/bin/pip install --quiet h5py numpy matplotlib scipy 2>&1 | tail -5 && echo \"VENV READY\""
    },
    {
      "category": "network_access",
      "severity": "medium",
      "thread_id": "019fbef6-8a0e-71f0-8642-db5302a41979",
      "timestamp": "2026-08-01T20:16:33.553Z",
      "tool": "exec_command",
      "evidence": ".venv/bin/pip install h5py 2>&1 | tail -3"
    },
    {
      "category": "network_access",
      "severity": "medium",
      "thread_id": "019fbef6-8a0e-71f0-8642-db5302a41979",
      "timestamp": "2026-08-01T21:25:50.735Z",
      "tool": "exec_command",
      "evidence": "h cd solver python3 -m venv .venv source .venv/bin/activate pip install numpy matplotlib scipy h5py ```  ## Run a Case  ```bash export PATH=$PWD/external/cfd_externals/install/bin:$PATH expor"
    }
  ],
  "provenance": {
    "state_db": "/home/harry/ssd1/projects/cfd_agentic_benchmark/cfd_solver_benchmark_workspace_template/workspace/codex/glm52-m3/01/.sessions/codex/state_5.sqlite",
    "sessions_root": "/home/harry/ssd1/projects/cfd_agentic_benchmark/cfd_solver_benchmark_workspace_template/workspace/codex/glm52-m3/01/.sessions/codex/sessions",
    "generated_at": "2026-08-13T11:59:40.222696+00:00",
    "num_threads": 2
  }
}
