{
  "workspace": "/mnt/ssd-SATARAID5/harry/projects/cfd_agentic_benchmark/cfd_solver_benchmark_workspace_template/workspace/claude/generic/opus-09",
  "tool_usage": {
    "total": 335,
    "by_tool": {
      "Bash": 165,
      "Edit": 65,
      "Read": 55,
      "Write": 19,
      "TaskUpdate": 12,
      "TaskCreate": 9,
      "Agent": 9,
      "ToolSearch": 1
    },
    "by_thread": {
      "cfdc5453-1ac8-4229-9859-aa4e2a87c0a8": {
        "Bash": 129,
        "Read": 21,
        "ToolSearch": 1,
        "TaskCreate": 9,
        "TaskUpdate": 12,
        "Write": 19,
        "Edit": 63,
        "Agent": 1
      },
      "cfdc5453-1ac8-4229-9859-aa4e2a87c0a8:a13d9bbfd23ec081b": {
        "Bash": 9,
        "Agent": 1,
        "Read": 11
      },
      "cfdc5453-1ac8-4229-9859-aa4e2a87c0a8:a16a85adc3f94d008": {
        "Bash": 13,
        "Agent": 4,
        "Read": 3,
        "Edit": 2
      },
      "cfdc5453-1ac8-4229-9859-aa4e2a87c0a8:a7d73507f7e0b8b2d": {
        "Bash": 4,
        "Agent": 1,
        "Read": 10
      },
      "cfdc5453-1ac8-4229-9859-aa4e2a87c0a8:ace3c5afabbfedd2e": {
        "Bash": 6,
        "Agent": 1
      },
      "cfdc5453-1ac8-4229-9859-aa4e2a87c0a8:afc3dfa74fa8fc8bb": {
        "Bash": 4,
        "Agent": 1,
        "Read": 10
      }
    },
    "subagent_spawns": 5,
    "risk_context": []
  },
  "loc": {
    "method": "git+file",
    "git": {
      "method": "git",
      "repos": {
        "workspace": {
          "branch": "claude/generic/opus-09",
          "commit": "7e16370db4546b8e957a612177f850742bf4b6f8",
          "tracked_source_files": 15,
          "tracked_source_lines": 3564,
          "by_extension": {
            "cmake": 81,
            "cpp": 2697,
            "hpp": 400,
            "py": 386
          },
          "diff_vs_base": {
            "added": 12,
            "deleted": 993,
            "base": "055f0f571aa3b9b8eab2819e49b8a07d2f1f09a4"
          }
        },
        "cfd_solver_agentic_benchmark": {
          "branch": "HEAD",
          "commit": "1bc6580b84825037bbeac097ede1b2226d8185d1",
          "tracked_source_files": 1,
          "tracked_source_lines": 324,
          "by_extension": {
            "py": 324
          },
          "diff_vs_base": null
        }
      },
      "lines_total": 3888
    },
    "file": {
      "method": "file",
      "files": 16,
      "lines": 3888,
      "by_extension": {
        "cmake": 81,
        "cpp": 2697,
        "hpp": 400,
        "py": 710
      }
    }
  },
  "rule_violations": [
    {
      "category": "unauthorized_remote_mutations",
      "severity": "high",
      "thread_id": "cfdc5453-1ac8-4229-9859-aa4e2a87c0a8",
      "timestamp": "2026-08-28T01:44:18.355Z",
      "tool": "Bash",
      "evidence": "{\"command\": \"git checkout -b solver/cfd-benchmark-attempt\", \"description\": \"Create new branch for solver work\"}"
    },
    {
      "category": "network_access",
      "severity": "medium",
      "thread_id": "cfdc5453-1ac8-4229-9859-aa4e2a87c0a8",
      "timestamp": "2026-08-28T04:24:12.483Z",
      "tool": "Bash",
      "evidence": "nd\": \"python3 -m venv .venv && source .venv/bin/activate && pip install numpy matplotlib 2>&1 | tail -5\", \"description\": \"Set up Python virtual environment\", \"timeout\": 120000}"
    },
    {
      "category": "suspicious_patterns",
      "severity": "medium",
      "thread_id": "cfdc5453-1ac8-4229-9859-aa4e2a87c0a8",
      "timestamp": "2026-08-28T04:30:45.862Z",
      "tool": "Bash",
      "evidence": "{\"command\": \"pkill -9 cfd2d 2>/dev/null; killall -9 mpirun 2>/dev/null; sleep 1; echo \\\"killed\\\"\", \"description\": \"Kill running processes\"}"
    }
  ],
  "provenance": {
    "claude_root": "/mnt/ssd-SATARAID5/harry/projects/cfd_agentic_benchmark/cfd_solver_benchmark_workspace_template/workspace/claude/generic/opus-09/.sessions/claude",
    "selected_roots": [
      "cfdc5453-1ac8-4229-9859-aa4e2a87c0a8"
    ],
    "generated_at": "2026-08-28T06:04:52.256052+00:00",
    "num_threads": 6
  }
}
