{
  "workspace": "/mnt/ssd-SATARAID5/harry/projects/cfd_agentic_benchmark/cfd_solver_benchmark_workspace_template/workspace/codex/gpt56/07",
  "tool_usage": {
    "total": 1238,
    "by_tool": {
      "exec_command": 631,
      "write_stdin": 425,
      "apply_patch": 131,
      "update_plan": 33,
      "codegraph_explore": 14,
      "get_goal": 2,
      "update_goal": 2
    },
    "by_thread": {
      "019fdbed-a7d0-7072-a8ca-4ce5a84e49c0": {
        "update_plan": 33,
        "exec_command": 631,
        "codegraph_explore": 14,
        "apply_patch": 131,
        "write_stdin": 425,
        "get_goal": 2,
        "update_goal": 2
      }
    },
    "subagent_spawns": 0,
    "risk_context": [
      {
        "thread_id": "019fdbed-a7d0-7072-a8ca-4ce5a84e49c0",
        "approval_policy": "on-request",
        "permission_profile": ":workspace"
      },
      {
        "thread_id": "019fdbed-a7d0-7072-a8ca-4ce5a84e49c0",
        "approval_policy": "on-request",
        "sandbox": "workspace-write",
        "network_access": false
      }
    ]
  },
  "loc": {
    "method": "git+file",
    "git": {
      "method": "git",
      "repos": {
        "workspace": {
          "branch": "codex/gpt56/07",
          "commit": "7ad799097f6d8426eb34d5a5ba092956a3e7d7b7",
          "tracked_source_files": 20,
          "tracked_source_lines": 4249,
          "by_extension": {
            "cmake": 53,
            "cpp": 2736,
            "hpp": 419,
            "py": 1041
          },
          "diff_vs_base": {
            "added": 4732,
            "deleted": 0,
            "base": "835bc07eaa03beeed2db88c13089b8e3e639f13b"
          }
        },
        "cfd_solver_agentic_benchmark": {
          "branch": "HEAD",
          "commit": "1bc6580b84825037bbeac097ede1b2226d8185d1",
          "tracked_source_files": 1,
          "tracked_source_lines": 324,
          "by_extension": {
            "py": 324
          },
          "diff_vs_base": null
        }
      },
      "lines_total": 4573
    },
    "file": {
      "method": "file",
      "files": 46,
      "lines": 10456,
      "by_extension": {
        "cmake": 53,
        "cpp": 2736,
        "hpp": 419,
        "py": 7248
      }
    }
  },
  "rule_violations": [],
  "provenance": {
    "state_db": "/mnt/ssd-SATARAID5/harry/projects/cfd_agentic_benchmark/cfd_solver_benchmark_workspace_template/workspace/codex/gpt56/07/.sessions/codex/state_5.sqlite",
    "sessions_root": "/mnt/ssd-SATARAID5/harry/projects/cfd_agentic_benchmark/cfd_solver_benchmark_workspace_template/workspace/codex/gpt56/07/.sessions/codex/sessions",
    "generated_at": "2026-08-15T06:44:45.843021+00:00",
    "num_threads": 1
  }
}
